{
  "$schema": "https://json-schema.org/draft/2020-12/schema",
  "$id": "https://repolens.example/schemas/sbom-1.0.json",
  "title": "RepoLens SBOM artifact",
  "type": "object",
  "required": ["schema_version", "repo", "generated_at", "tool", "source", "artifacts"],
  "properties": {
    "schema_version": {"const": "1.0"},
    "repo": {"type": "string", "minLength": 1},
    "generated_at": {"type": "string", "minLength": 1},
    "tool": {
      "type": "object",
      "required": ["name", "version"],
      "properties": {
        "name": {"type": "string", "minLength": 1},
        "version": {"type": "string", "minLength": 1}
      },
      "additionalProperties": true
    },
    "source": {"type": "string", "minLength": 1},
    "artifacts": {
      "type": "array",
      "items": {
        "type": "object",
        "required": ["name", "version", "type"],
        "properties": {
          "name": {"type": "string", "minLength": 1},
          "version": {"type": "string", "minLength": 1},
          "type": {"type": "string", "minLength": 1},
          "purl": {"type": "string"},
          "licenses": {"type": "array", "items": {"type": "string"}},
          "locations": {"type": "array", "items": {"type": "string"}}
        },
        "additionalProperties": true
      }
    }
  },
  "additionalProperties": true
}
